{
  "$schema": "https://llm-catalog.example.cn/schemas/models-dev-candidates.schema.json",
  "filter": {
    "comparison": ">=",
    "field": "created",
    "semantics": "models.dev catalog created timestamp; not an official release-date assertion",
    "since": "2026-01-01"
  },
  "models": [
    {
      "api_model_id": "anthropic/claude-opus-4.7-fast",
      "candidate_id": "models-dev/anthropic/claude-opus-4.7-fast",
      "canonical_slug": "anthropic/claude-4.7-opus-fast-20260512",
      "context_length": 1000000,
      "input_modalities": [
        "file",
        "image",
        "text"
      ],
      "max_output_tokens": 128000,
      "models_dev_created_at": "2026-05-12",
      "name": "Anthropic: Claude Opus 4.7 (Fast)",
      "output_modalities": [
        "text"
      ],
      "provider_id": "anthropic",
      "route_kind": "direct",
      "source_url": "https://models.dev/models.json",
      "supported_parameters": [
        "include_reasoning",
        "max_tokens",
        "reasoning",
        "response_format",
        "stop",
        "structured_outputs",
        "tool_choice",
        "tools",
        "verbosity"
      ],
      "verification_status": "unverified"
    },
    {
      "api_model_id": "perceptron/perceptron-mk1",
      "candidate_id": "models-dev/perceptron/perceptron-mk1",
      "canonical_slug": "perceptron/perceptron-mk1-20260512",
      "context_length": 32768,
      "input_modalities": [
        "image",
        "text",
        "video"
      ],
      "max_output_tokens": 8192,
      "models_dev_created_at": "2026-05-12",
      "name": "Perceptron: Perceptron Mk1",
      "output_modalities": [
        "text"
      ],
      "provider_id": "perceptron",
      "route_kind": "direct",
      "source_url": "https://models.dev/models.json",
      "supported_parameters": [
        "frequency_penalty",
        "include_reasoning",
        "max_tokens",
        "presence_penalty",
        "reasoning",
        "structured_outputs",
        "temperature",
        "top_k",
        "top_p"
      ],
      "verification_status": "unverified"
    },
    {
      "api_model_id": "inclusionai/ring-2.6-1t:free",
      "candidate_id": "models-dev/inclusionai/ring-2.6-1t:free",
      "canonical_slug": "inclusionai/ring-2.6-1t-20260508",
      "context_length": 262144,
      "input_modalities": [
        "text"
      ],
      "max_output_tokens": 65536,
      "models_dev_created_at": "2026-05-08",
      "name": "inclusionAI: Ring-2.6-1T (free)",
      "output_modalities": [
        "text"
      ],
      "provider_id": "inclusionai",
      "route_kind": "free",
      "source_url": "https://models.dev/models.json",
      "supported_parameters": [
        "frequency_penalty",
        "include_reasoning",
        "max_tokens",
        "presence_penalty",
        "reasoning",
        "repetition_penalty",
        "seed",
        "stop",
        "temperature",
        "tool_choice",
        "tools",
        "top_k",
        "top_p"
      ],
      "verification_status": "unverified"
    },
    {
      "api_model_id": "google/gemini-3.1-flash-lite",
      "candidate_id": "models-dev/google/gemini-3.1-flash-lite",
      "canonical_slug": "google/gemini-3.1-flash-lite-20260507",
      "context_length": 1048576,
      "input_modalities": [
        "audio",
        "file",
        "image",
        "text",
        "video"
      ],
      "max_output_tokens": 65536,
      "models_dev_created_at": "2026-05-07",
      "name": "Google: Gemini 3.1 Flash Lite",
      "output_modalities": [
        "text"
      ],
      "provider_id": "google",
      "route_kind": "direct",
      "source_url": "https://models.dev/models.json",
      "supported_parameters": [
        "include_reasoning",
        "max_tokens",
        "reasoning",
        "response_format",
        "seed",
        "stop",
        "structured_outputs",
        "temperature",
        "tool_choice",
        "tools",
        "top_p"
      ],
      "verification_status": "unverified"
    },
    {
      "api_model_id": "baidu/cobuddy:free",
      "candidate_id": "models-dev/baidu/cobuddy:free",
      "canonical_slug": "baidu/cobuddy-20260430",
      "context_length": 131072,
      "input_modalities": [
        "text"
      ],
      "max_output_tokens": 65536,
      "models_dev_created_at": "2026-05-06",
      "name": "Baidu Qianfan: CoBuddy (free)",
      "output_modalities": [
        "text"
      ],
      "provider_id": "baidu",
      "route_kind": "free",
      "source_url": "https://models.dev/models.json",
      "supported_parameters": [
        "include_reasoning",
        "max_tokens",
        "reasoning",
        "stop",
        "tools"
      ],
      "verification_status": "unverified"
    },
    {
      "api_model_id": "openai/gpt-chat-latest",
      "candidate_id": "models-dev/openai/gpt-chat-latest",
      "canonical_slug": "openai/gpt-chat-latest-20260505",
      "context_length": 400000,
      "input_modalities": [
        "file",
        "image",
        "text"
      ],
      "max_output_tokens": 128000,
      "models_dev_created_at": "2026-05-05",
      "name": "OpenAI: GPT Chat Latest",
      "output_modalities": [
        "text"
      ],
      "provider_id": "openai",
      "route_kind": "direct",
      "source_url": "https://models.dev/models.json",
      "supported_parameters": [
        "frequency_penalty",
        "logit_bias",
        "logprobs",
        "max_tokens",
        "presence_penalty",
        "response_format",
        "seed",
        "stop",
        "structured_outputs",
        "tool_choice",
        "tools",
        "top_logprobs"
      ],
      "verification_status": "unverified"
    },
    {
      "api_model_id": "ibm-granite/granite-4.1-8b",
      "candidate_id": "models-dev/ibm-granite/granite-4.1-8b",
      "canonical_slug": "ibm-granite/granite-4.1-8b-20260429",
      "context_length": 131072,
      "input_modalities": [
        "text"
      ],
      "max_output_tokens": 131072,
      "models_dev_created_at": "2026-04-30",
      "name": "IBM: Granite 4.1 8B",
      "output_modalities": [
        "text"
      ],
      "provider_id": "ibm-granite",
      "route_kind": "direct",
      "source_url": "https://models.dev/models.json",
      "supported_parameters": [
        "frequency_penalty",
        "max_tokens",
        "presence_penalty",
        "repetition_penalty",
        "response_format",
        "seed",
        "stop",
        "structured_outputs",
        "temperature",
        "tool_choice",
        "tools",
        "top_k",
        "top_p"
      ],
      "verification_status": "unverified"
    },
    {
      "api_model_id": "mistralai/mistral-medium-3-5",
      "candidate_id": "models-dev/mistralai/mistral-medium-3-5",
      "canonical_slug": "mistralai/mistral-medium-3.5-20260430",
      "context_length": 262144,
      "input_modalities": [
        "file",
        "image",
        "text"
      ],
      "max_output_tokens": "unknown",
      "models_dev_created_at": "2026-04-30",
      "name": "Mistral: Mistral Medium 3.5",
      "output_modalities": [
        "text"
      ],
      "provider_id": "mistralai",
      "route_kind": "direct",
      "source_url": "https://models.dev/models.json",
      "supported_parameters": [
        "frequency_penalty",
        "include_reasoning",
        "max_tokens",
        "presence_penalty",
        "reasoning",
        "response_format",
        "seed",
        "stop",
        "structured_outputs",
        "temperature",
        "tool_choice",
        "tools",
        "top_p"
      ],
      "verification_status": "unverified"
    },
    {
      "api_model_id": "x-ai/grok-4.3",
      "candidate_id": "models-dev/x-ai/grok-4.3",
      "canonical_slug": "x-ai/grok-4.3-20260430",
      "context_length": 1000000,
      "input_modalities": [
        "image",
        "text"
      ],
      "max_output_tokens": "unknown",
      "models_dev_created_at": "2026-04-30",
      "name": "xAI: Grok 4.3",
      "output_modalities": [
        "text"
      ],
      "provider_id": "x-ai",
      "route_kind": "direct",
      "source_url": "https://models.dev/models.json",
      "supported_parameters": [
        "frequency_penalty",
        "include_reasoning",
        "logprobs",
        "max_tokens",
        "presence_penalty",
        "reasoning",
        "response_format",
        "seed",
        "stop",
        "structured_outputs",
        "temperature",
        "tool_choice",
        "tools",
        "top_logprobs",
        "top_p"
      ],
      "verification_status": "unverified"
    },
    {
      "api_model_id": "nvidia/nemotron-3-nano-omni-30b-a3b-reasoning:free",
      "candidate_id": "models-dev/nvidia/nemotron-3-nano-omni-30b-a3b-reasoning:free",
      "canonical_slug": "nvidia/nemotron-3-nano-omni-30b-a3b-reasoning-20260428",
      "context_length": 256000,
      "input_modalities": [
        "audio",
        "image",
        "text",
        "video"
      ],
      "max_output_tokens": 65536,
      "models_dev_created_at": "2026-04-28",
      "name": "NVIDIA: Nemotron 3 Nano Omni (free)",
      "output_modalities": [
        "text"
      ],
      "provider_id": "nvidia",
      "route_kind": "free",
      "source_url": "https://models.dev/models.json",
      "supported_parameters": [
        "include_reasoning",
        "max_tokens",
        "reasoning",
        "seed",
        "temperature",
        "tool_choice",
        "tools",
        "top_p"
      ],
      "verification_status": "unverified"
    },
    {
      "api_model_id": "openrouter/owl-alpha",
      "candidate_id": "models-dev/openrouter/owl-alpha",
      "canonical_slug": "openrouter/owl-alpha",
      "context_length": 1048756,
      "input_modalities": [
        "text"
      ],
      "max_output_tokens": 262144,
      "models_dev_created_at": "2026-04-28",
      "name": "Owl Alpha",
      "output_modalities": [
        "text"
      ],
      "provider_id": "openrouter",
      "route_kind": "router",